<?xml version="1.0" encoding="utf-8"?>
<alignmentML xmlns="http://hobit.sourceforge.net/xsds/20060602/alignmentML" xmlns:xsi="http://www.w3.org/2001/XMLSchema-instance" xsi:schemaLocation="http://hobit.sourceforge.net/xsds/20060602/alignmentML http://bibiserv.techfak.uni-bielefeld.de/xsd/net/sourceforge/hobit/20060602/alignmentML.xsd">
  <alignment>
    <sequence seqID="Sequence_1">
      <description>Comment</description>
      <alignedAminoAcidSequence>ABCAHCANCNCNAHCHACHAHCNBNABCAHCANCNCNAHCHACHAHCNBNABCAHCANCNCNAHCHACHAHCNBNABCAHCANCNCNAHCHACHAHCNBNABCAHCANCNCNAHCHACHAHCNBNABCAHCANCNCNAHCHACHAHCNBNABCAHCANCNCNAHCHACHAHCNBN</alignedAminoAcidSequence>
    </sequence>
    <sequence seqID="Sequence_2">
      <description>Comment2</description>
      <alignedAminoAcidSequence>BDABCBACBABBCKLAKLCKLABKNABCAHCANCNCNAHCHACHAHCNBNABCAHCANCNCNAHCHACHAHCNBNABCAHCANCNCNAHCHACHAHCNBNABCAHCANCNCNAHCHACHAHCNBNABCAHCANCNCNAHCHACHAHCNBNABCAHCANCNCNAHCHACHAHCNBN</alignedAminoAcidSequence>
    </sequence>
  </alignment>
</alignmentML>
